{
  "format": "rillswap-recovery",
  "format_version": "1-pre.1",
  "specification_version": "0.1.0-pre.1",
  "created_at": 1700000100,
  "updated_at": 1700000100,
  "network_identity": {
    "family": "bitcoin",
    "name": "regtest",
    "genesis_hash": "0f9188f13cb7b2c71f2a335e3a4fc328bf5beb436012afca590b1a11466e2206",
    "signet_challenge": null,
    "consensus_profile": "bitcoin-core-v30.0-regtest-default",
    "deployment_namespace": "rillswap-e2e-v1"
  },
  "profile_id": "ln-to-btc/v1",
  "contract_hash": "a8452cc7dd66fe871a48d08501dc835297b63be72a2e2436d2e1611d323a0c40",
  "contract_terms": {
    "protocol": "rillswap",
    "contract_version": "1",
    "profile_id": "ln-to-btc/v1",
    "network_identity": {
      "family": "bitcoin",
      "name": "regtest",
      "genesis_hash": "0f9188f13cb7b2c71f2a335e3a4fc328bf5beb436012afca590b1a11466e2206",
      "signet_challenge": null,
      "consensus_profile": "bitcoin-core-v30.0-regtest-default",
      "deployment_namespace": "rillswap-e2e-v1"
    },
    "provider_identity_key": "79be667ef9dcbbac55a06295ce870b07029bfcdb2dce28d959f2815b16f81798",
    "client_contract_compressed_key": "03a0434d9e47f3c86235477c7b1ae6ae5d3442d49b1943c2b752a68e2a47e247c7",
    "provider_contract_compressed_key": "03774ae7f858a9411e5ef4246b70c65aac5649980be5c17891bbec17895da008cb",
    "claimant": "client",
    "refund_party": "provider",
    "invoice_binding": {
      "bolt11_sha256": "78adcc26db98c1222d1cf602d3715c2758247b1d32eb28e57af61d517f58181c",
      "payment_hash": "16b72cfab7dbca73cb348f4e59a74b5c56d6e95574c1e9ca84850d69f5fa9430",
      "amount_msat": "102000000",
      "payee_compressed_pubkey": "03f28773c2d975288bc7d1d205c3748651b075fbc6610e58cddeeddf8f19405aa8",
      "created_at": 1700000000,
      "expires_at": 1700003600,
      "min_final_cltv_delta": 18
    },
    "economics": {
      "kind": "ln-to-btc",
      "contract_amount_sat": "100500",
      "nominal_payout_sat": "100000",
      "claim_fee_reserve_sat": "500",
      "success_fee_sat": "1500",
      "mining_prepayment_sat": "0",
      "hold_invoice_sat": "102000"
    },
    "refund_lock_height": 1100,
    "funding_confirmations": 2,
    "settlement_confirmations": 3,
    "refund_resolution_confirmations": 4,
    "max_funding_fee_sat": "500",
    "max_claim_fee_sat": "400",
    "max_refund_fee_sat": "600",
    "client_destination_script": "00143131313131313131313131313131313131313131",
    "provider_destination_script": "5120499fdf9e895e719cfd64e67f07d38e3226aa7b63678949e6e49b241a60e823e4",
    "recovery_authorization_xonly_key": "d01115d548e7561b15c38f004d734633687cf4419620095bc5b0f47070afe85a",
    "terms_expiry": 1700001800,
    "timing_policy": {
      "kind": "ln-to-btc",
      "min_incoming_htlc_expiry_height": 1130,
      "refund_and_ln_resolution_blocks": 20,
      "client_response_blocks": 6,
      "claim_confirmation_blocks": 6
    },
    "required_features": [],
    "extensions": {}
  },
  "verification_context": {
    "handshake_init": {
      "protocol": "rillswap",
      "wire_version": "1",
      "profile_id": "ln-to-btc/v1",
      "network_identity": {
        "family": "bitcoin",
        "name": "regtest",
        "genesis_hash": "0f9188f13cb7b2c71f2a335e3a4fc328bf5beb436012afca590b1a11466e2206",
        "signet_challenge": null,
        "consensus_profile": "bitcoin-core-v30.0-regtest-default",
        "deployment_namespace": "rillswap-e2e-v1"
      },
      "session_id": "ad65eb07f6dd489b072217dc5496d8172048961a26d94562ff9073dc258b2b66",
      "client_challenge": "2121212121212121212121212121212121212121212121212121212121212121",
      "client_session_xonly_key": "2f01e5e15cca351daff3843fb70f3c2f0a1bdd05e5af888a67784ef3e10a2a01",
      "expected_provider_identity_xonly_key": "79be667ef9dcbbac55a06295ce870b07029bfcdb2dce28d959f2815b16f81798",
      "requested_encryption_suites": [
        "noise-xk-secp256k1-chachapoly-sha256/v1"
      ],
      "requested_capabilities": [
        "core/v1",
        "recovery/v1"
      ],
      "required_features": [
        "epoch-bound-session/v1"
      ],
      "extensions": {
        "rillswap/epoch-bound-session": {
          "epoch_inbox_xonly_key": "d7924d4f7d43ea965a465ae3095ff41131e5946f3c85f79e44adbcf8e27e080e"
        }
      }
    },
    "handshake_accept": {
      "handshake_init_hash": "352ad91eb58f124d79ab887b40ac8286eb74304df13abefaa32abd24fce063e4",
      "protocol": "rillswap",
      "wire_version": "1",
      "profile_id": "ln-to-btc/v1",
      "network_identity": {
        "family": "bitcoin",
        "name": "regtest",
        "genesis_hash": "0f9188f13cb7b2c71f2a335e3a4fc328bf5beb436012afca590b1a11466e2206",
        "signet_challenge": null,
        "consensus_profile": "bitcoin-core-v30.0-regtest-default",
        "deployment_namespace": "rillswap-e2e-v1"
      },
      "session_id": "ad65eb07f6dd489b072217dc5496d8172048961a26d94562ff9073dc258b2b66",
      "client_challenge": "2121212121212121212121212121212121212121212121212121212121212121",
      "provider_challenge": "2222222222222222222222222222222222222222222222222222222222222222",
      "client_session_xonly_key": "2f01e5e15cca351daff3843fb70f3c2f0a1bdd05e5af888a67784ef3e10a2a01",
      "provider_session_xonly_key": "acd484e2f0c7f65309ad178a9f559abde09796974c57e714c35f110dfc27ccbe",
      "provider_identity_xonly_key": "79be667ef9dcbbac55a06295ce870b07029bfcdb2dce28d959f2815b16f81798",
      "selected_encryption_suite": "noise-xk-secp256k1-chachapoly-sha256/v1",
      "selected_capabilities": [
        "core/v1",
        "recovery/v1"
      ],
      "transport_endpoints": [
        "wss://provider.rillswap.invalid/v1"
      ],
      "required_features": [
        "epoch-bound-session/v1"
      ],
      "extensions": {}
    },
    "provider_identity_signature": "ed21422127769070edb3c1e8e3cce70c06114450bb7a8931342443a1cfdf35be948e040b90d783bafcb02bd1db691365708c3dbe6ad6034e6cc04a329c1b2962",
    "handshake_hash": "eef117c9eb26506ca6d6f102025d2dcb1f698d2afc6fb2af1940c9447357a9a3",
    "client_session_xonly_key": "2f01e5e15cca351daff3843fb70f3c2f0a1bdd05e5af888a67784ef3e10a2a01",
    "provider_session_xonly_key": "acd484e2f0c7f65309ad178a9f559abde09796974c57e714c35f110dfc27ccbe",
    "expected_provider_identity_source": {
      "kind": "manual",
      "advertisement_digest": null
    },
    "provider_terms_signature": "707d953e78c1acf4c58e282af8dfc1f1d67170f475f1e8f56150d9c1bd3104267638472f75f9ba64ec939bde2fa5fd65c2f524a382c0c50a65d45e466605a6bb",
    "client_acceptance_signature": "42dee08cbfdf23e62b0394b9c9015d58b2602bce67a251c7cc9932274e0ea1ee42d650c784eba0645e7686107b1d8345504ab2dd90d0bb4ac2212ecf244af3d2"
  },
  "taproot_contract": {
    "internal_xonly_key": "f661a9ce7a6581718c39eaa58aba92fe7fd56aaa28cac83907870526e21e6a1e",
    "internal_key_parity": 1,
    "claim_script": "82012088a82016b72cfab7dbca73cb348f4e59a74b5c56d6e95574c1e9ca84850d69f5fa94308820a0434d9e47f3c86235477c7b1ae6ae5d3442d49b1943c2b752a68e2a47e247c7ac",
    "refund_script": "024c04b17520774ae7f858a9411e5ef4246b70c65aac5649980be5c17891bbec17895da008cbac",
    "claim_leaf_hash": "d3588455ebbd2c329c6300df5d09633025f112849d7bea8db3f91bf21123dc63",
    "refund_leaf_hash": "bbad6d29ff92f97d41acf8f7d0436626746ba112eef14e4f3b7c1d0ee030afdd",
    "merkle_root": "a1de07b1609ffc923b389e341f4931e45bd4e998524e4e69689888bc08a29a95",
    "tap_tweak": "90618757ca5a8b058891825bc820fb94f7b284bf72215e605ff5b08caad55781",
    "output_xonly_key": "357a90c68cc55e5e69721adbf89b7d03d08ce9a518626f67e0a732b610a211ec",
    "output_key_parity": 0,
    "script_pubkey": "5120357a90c68cc55e5e69721adbf89b7d03d08ce9a518626f67e0a732b610a211ec",
    "claim_control_block": "c0f661a9ce7a6581718c39eaa58aba92fe7fd56aaa28cac83907870526e21e6a1ebbad6d29ff92f97d41acf8f7d0436626746ba112eef14e4f3b7c1d0ee030afdd",
    "refund_control_block": "c0f661a9ce7a6581718c39eaa58aba92fe7fd56aaa28cac83907870526e21e6a1ed3588455ebbd2c329c6300df5d09633025f112849d7bea8db3f91bf21123dc63"
  },
  "user_secret": {
    "kind": "raw-secp256k1-v1",
    "contract_secret_key": "000000000000000000000000000000000000000000000000000000000000000a"
  },
  "funding_history": [],
  "chain_scan_birthday_height": 900,
  "fee_policy": {
    "max_claim_fee_sat": "400",
    "max_refund_fee_sat": "600"
  },
  "recovery_authorization_xonly_key": "d01115d548e7561b15c38f004d734633687cf4419620095bc5b0f47070afe85a",
  "monotonic_knowledge": {
    "preimage_known": true,
    "preimage": "5252525252525252525252525252525252525252525252525252525252525252",
    "dangerous_signature_issued": false
  },
  "extensions": {}
}
